{
  "schema_version": "5.0",
  "criteria_version": "5.0.0",
  "repo": "IntersectMBO/cardano-ledger",
  "date": "2026-03-27",
  "agent_model": "claude-opus-4-6[1m]",
  "readiness": {
    "structure": {
      "status": "practiced",
      "rubric": {
        "S1": {
          "met": true,
          "evidence": "cabal.project with 28+ packages across eras/ and libs/ directories. Multi-package monorepo with explicit module boundaries per ledger era."
        },
        "S2": {
          "met": true,
          "evidence": "flake.lock present (Nix lockfile pins all dependencies reproducibly). GHC version matrix in CI (9.6-9.14). Nix flake provides hermetic builds."
        },
        "S3": {
          "met": true,
          "evidence": ".github/workflows/haskell.yml active — triggers on PR, master push, and nightly schedule. 29 recently merged PRs confirm active CI. Additional workflows: push-specs.yml, bench.yml, gh-pages.yml."
        },
        "S4": {
          "met": true,
          "evidence": "KB-validated pattern: hlint runs via nix develop --command (Nix-wrapped CI pattern). fourmolu.yaml present. No standalone .hlint.yaml but KB confirms hlint is embedded in flake.nix for this repo. Confidence: MEDIUM (Nix-wrapped detection)."
        },
        "S5": {
          "met": true,
          "evidence": "fourmolu.yaml present at repo root. Formatting enforced in CI (haskell.yml). KB pattern 'HLint + fourmolu as standard tooling' validated."
        }
      },
      "rubric_score": "5/5",
      "confidence": "HIGH",
      "depth_findings": [
        "28+ cabal packages provide strong module boundaries per ledger era (Byron, Shelley, Allegra, Mary, Alonzo, Babbage, Conway) plus shared libraries. KB pattern 'cabal multi-package as module boundary signal' validated.",
        "Nix-based build system (flake.nix + flake.lock) provides fully reproducible builds. This is stronger than lockfile-only approaches — Nix pins the entire toolchain including GHC, hlint, fourmolu, and all system dependencies.",
        "CI matrix tests across GHC 9.6 through 9.14, providing forward-compatibility verification. This is unusually thorough.",
        "Formatter (fourmolu) is CI-enforced, not just configured. S4 (hlint) detection relies on KB-validated Nix-wrapped pattern — scanner cannot directly grep for hlint in workflow YAML because it runs via nix develop."
      ]
    },
    "clarity": {
      "status": "practiced",
      "rubric": {
        "C1": {
          "met": true,
          "evidence": "Haskell = auto-pass per rubric. Strong static type system with algebraic data types, type classes, and GADTs used extensively across ledger eras."
        },
        "C2": {
          "met": false,
          "evidence": "KB reports 45.8% Haddock coverage across 38 packages. Criterion requires >50% of public items with doc comments. Below threshold. Note: coverage is substantial but does not meet the bar."
        },
        "C3": {
          "met": true,
          "evidence": "README.md with ~500 words. Describes all ledger eras (Byron through Conway), links to formal specifications, includes repository structure section explaining package organization."
        },
        "C4": {
          "met": true,
          "evidence": ".cddl schema files per era: allegra.cddl, alonzo.cddl, babbage.cddl, conway.cddl, byron.cddl. CDDL (Concise Data Definition Language) defines binary wire format contracts for each ledger era."
        },
        "C5": {
          "met": true,
          "evidence": "fourmolu enforces formatting style rules. HLint (via Nix) provides code style hints and naming conventions. KB pattern 'HLint + fourmolu as standard tooling' applies."
        }
      },
      "rubric_score": "4/5",
      "confidence": "HIGH",
      "depth_findings": [
        "C2 (Haddock coverage) at 45.8% is close to the 50% threshold but does not meet it. This is a known gap — KB pattern 'Haddock documentation coverage' tracks this. The gap is concentrated in implementation modules rather than public API surfaces, so effective coverage of the public API may be higher than the aggregate number suggests.",
        "CDDL schema files are a strong clarity signal — they define the exact binary serialization format for each ledger era, serving as machine-readable interface contracts. CddlSpec.hs test files verify conformance.",
        "Haskell's type system serves as living documentation: type signatures on exported functions describe contracts more precisely than doc comments in most languages. The 45.8% Haddock gap is partially compensated by type-level documentation.",
        "Servant-style typed APIs and era-indexed type families provide self-documenting interfaces across ledger eras."
      ]
    },
    "purpose": {
      "status": "practiced",
      "rubric": {
        "P1": {
          "met": true,
          "evidence": "README.md contains a repository structure section describing the multi-era package organization, era relationships, and formal specification links. While no dedicated ARCHITECTURE.md exists, the README architecture content exceeds 100 words of substantive structural description."
        },
        "P2": {
          "met": true,
          "evidence": "docs/adr/ directory with 9 ADRs (001-009). Well above the >=3 threshold."
        },
        "P3": {
          "met": false,
          "evidence": "No PRD, FRD, user stories, or requirements documents found. The repo contains formal mathematical specifications (Haskell/Agda) which define ledger rules, but these are implementation specifications, not product context documents explaining user needs or business requirements."
        },
        "P4": {
          "met": true,
          "evidence": ".github/PULL_REQUEST_TEMPLATE.md with structured checklist: description, tests, changelog, formatting, CDDL conformance, self-review. This serves as a Definition of Done with acceptance criteria."
        },
        "P5": {
          "met": true,
          "evidence": "README describes ecosystem position: 'Formal specifications, executable models, and implementations of the Cardano Ledger'. Era-based structure (Byron through Conway) explains evolution. Links to formal specs provide cross-repo context with the Cardano ecosystem."
        }
      },
      "rubric_score": "4/5",
      "confidence": "MEDIUM",
      "depth_findings": [
        "9 ADRs (001-009) is strong for architectural documentation. ADR quality cannot be assessed without reading content, but the presence and numbering suggest systematic decision recording.",
        "P3 (product context) is understandably absent — this is a formal specification implementation repo, not a product-facing application. The 'product context' is the Cardano ledger specification itself. This is an artifact of the criterion not fully fitting infrastructure/protocol repos. Flagged for CoE lead consideration.",
        "P1 assessed as YES based on README architecture section. No dedicated ARCHITECTURE.md exists. The README section describes package organization by era but may not cover architectural decisions, trade-offs, or cross-cutting concerns in depth.",
        "PR template checklist includes CDDL conformance check — this is domain-specific quality assurance that goes beyond generic DoD patterns."
      ]
    },
    "workflow": {
      "status": "practiced",
      "rubric": {
        "W1": {
          "met": true,
          "evidence": "CONTRIBUTING.md with ~300 words. Covers trunk-based development, team roles, releasing process, and GHC transition notes. Substantive contributor guidance."
        },
        "W2": {
          "met": true,
          "evidence": ".github/PULL_REQUEST_TEMPLATE.md with structured checklist (description, tests, changelog, formatting, CDDL, self-review)."
        },
        "W3": {
          "met": true,
          "evidence": ".github/ISSUE_TEMPLATE/ with 3 templates: config.yml, feature_idea_ledger.yml, release-packages.md."
        },
        "W4": {
          "met": true,
          "evidence": "CODEOWNERS file present with @IntersectMBO/cardano-ledger-maintainers for repo-wide ownership and @IntersectMBO/core-tech-devx for Nix files."
        },
        "W5": {
          "met": false,
          "evidence": "No .aiignore found. No CLAUDE.md, .cursor/, .cursorrules, .mcp.json, .github/copilot-instructions.md, AGENTS.md, or GEMINI.md found. No AI config with trust boundary definitions. This is a critical gap for a high-assurance financial ledger implementation."
        }
      },
      "rubric_score": "4/5",
      "confidence": "HIGH",
      "depth_findings": [
        "CONTRIBUTING.md describes trunk-based development — PRs merge to master, no long-lived branches. This is consistent with the 29 recently merged PRs pattern.",
        "CODEOWNERS separates Nix infrastructure (@core-tech-devx) from ledger code (@cardano-ledger-maintainers) — good ownership boundary.",
        "3 issue templates (config, feature request, release) show structured issue intake. The release-packages template indicates a formal release process.",
        "W5 (trust boundaries) is the most impactful gap. This repo implements the Cardano ledger — a high-assurance financial system. Cryptographic modules, consensus-critical code, and formal specification implementations are security-sensitive paths that should be explicitly marked as requiring human review if AI tools are used."
      ]
    },
    "safety_net": {
      "status": "practiced",
      "rubric": {
        "SN1": {
          "met": true,
          "evidence": "test/ directories under each era: eras/allegra/impl/test/, eras/alonzo/impl/test/, etc. Extensive test infrastructure."
        },
        "SN2": {
          "met": true,
          "evidence": "Multiple test types visible: (1) Unit tests via Spec.hs files, (2) CDDL conformance tests via CddlSpec.hs, (3) Property-based tests via QuickCheck Arbitrary instances in testlib/ directories. At least 3 distinct categories."
        },